{
  "$schema": "http://json-schema.org/draft-07/schema#",
  "$id": "question.schema.json",
  "type": "object",
  "required": [
    "id",
    "domain",
    "question",
    "options",
    "answer",
    "explanation",
    "topic"
  ],
  "properties": {
    "id": {
      "type": "string",
      "pattern": "^q\\d+$"
    },
    "domain": {
      "type": "string",
      "minLength": 1
    },
    "question": {
      "type": "string",
      "minLength": 1
    },
    "options": {
      "type": "array",
      "minItems": 2,
      "items": {
        "type": "string"
      }
    },
    "answer": {
      "type": "integer",
      "minimum": 0
    },
    "explanation": {
      "type": "string",
      "minLength": 1
    },
    "topic": {
      "type": "string",
      "minLength": 1
    }
  },
  "additionalProperties": false
}
