[
  {
    "id": "q1",
    "domain": "Data / ML / Evaluation",
    "question": "نموذج فحص لمرض نادر: 1% فقط من العينات إيجابية. نموذج يتنبأ دائمًا «سلبي» ويحقق 99% Accuracy. ما المشكلة الأساسية؟",
    "options": [
      "النموذج ممتاز لأن Accuracy عالية",
      "Accuracy مضللة بسبب عدم توازن الفئات",
      "المشكلة الوحيدة هي حجم الـbatch"
    ],
    "answer": 1,
    "explanation": "مع فئة إيجابية نادرة، يمكن لنموذج عديم الفائدة أن يحقق Accuracy مرتفعة جدًا.",
    "topic": "Metrics & classification"
  },
  {
    "id": "q2",
    "domain": "Data / ML / Evaluation",
    "question": "في فحص Screening، تكلفة الـFalse Negative أعلى بكثير من الـFalse Positive. أي مقياس تعطيه أولوية غالبًا؟",
    "options": [
      "Recall / Sensitivity",
      "Precision",
      "R²"
    ],
    "answer": 0,
    "explanation": "عندما يكون تفويت الحالة الإيجابية أخطر، يصبح Recall/Sensitivity مهمًا.",
    "topic": "Metrics & classification"
  },
  {
    "id": "q3",
    "domain": "Data / ML / Evaluation",
    "question": "نظام تنبيه يرسل مراجعة بشرية مكلفة جدًا لكل Positive. تريد تقليل الإنذارات الكاذبة. أي مقياس يهم أكثر؟",
    "options": [
      "Precision",
      "Recall",
      "RMSE"
    ],
    "answer": 0,
    "explanation": "ارتفاع Precision يعني أن نسبة أكبر من التنبؤات الإيجابية صحيحة، فيقل عدد الإنذارات الكاذبة.",
    "topic": "Metrics & classification"
  },
  {
    "id": "q4",
    "domain": "Data / ML / Evaluation",
    "question": "أي تقسيم هو الأفضل لضبط hyperparameters ثم إعطاء تقدير نهائي غير متحيز للأداء؟",
    "options": [
      "Train فقط",
      "Train + Validation + Test",
      "Train + Test مع استخدام Test أثناء الضبط"
    ],
    "answer": 1,
    "explanation": "Validation للضبط، وTest يبقى معزولًا للتقييم النهائي.",
    "topic": "Metrics & classification"
  },
  {
    "id": "q5",
    "domain": "Data / ML / Evaluation",
    "question": "أي مثال يمثل Data Leakage؟",
    "options": [
      "استخدام نتيجة لا تُعرف إلا بعد الحدث كـfeature أثناء التدريب",
      "إزالة الصفوف المكررة",
      "استخدام Stratified Split"
    ],
    "answer": 0,
    "explanation": "الميزة التي لن تكون متاحة وقت inference تسرب معلومات مستقبلية للنموذج.",
    "topic": "Metrics & classification"
  },
  {
    "id": "q6",
    "domain": "Data / ML / Evaluation",
    "question": "عند تقسيم dataset غير متوازنة، ما الذي يساعد على الحفاظ على نسب الفئات في كل جزء؟",
    "options": [
      "Stratified split",
      "Random seed فقط",
      "زيادة learning rate"
    ],
    "answer": 0,
    "explanation": "Stratification يحافظ على توزيع الفئات تقريبًا بين train/validation/test.",
    "topic": "Validation & generalization"
  },
  {
    "id": "q7",
    "domain": "Data / ML / Evaluation",
    "question": "ما الغرض الأساسي من Cross-Validation؟",
    "options": [
      "تقدير generalization بشكل أكثر استقرارًا",
      "تحويل classification إلى regression",
      "زيادة عدد features"
    ],
    "answer": 0,
    "explanation": "Cross-validation يكرر التدريب/التقييم على طيات متعددة لتقليل حساسية النتيجة لتقسيم واحد.",
    "topic": "Validation & generalization"
  },
  {
    "id": "q8",
    "domain": "Data / ML / Evaluation",
    "question": "أداء النموذج 99% على train و70% على validation. ما التشخيص الأقرب؟",
    "options": [
      "Overfitting",
      "Underfitting",
      "Perfect calibration"
    ],
    "answer": 0,
    "explanation": "الفجوة الكبيرة بين train وvalidation علامة نموذجية على overfitting.",
    "topic": "Validation & generalization"
  },
  {
    "id": "q9",
    "domain": "Data / ML / Evaluation",
    "question": "الأداء ضعيف على train وضعيف على validation معًا. ما التشخيص الأقرب؟",
    "options": [
      "Underfitting",
      "Data leakage",
      "Overfitting فقط"
    ],
    "answer": 0,
    "explanation": "ضعف التدريب نفسه يشير عادةً إلى أن النموذج أبسط من اللازم أو لا يتعلم الإشارة المطلوبة.",
    "topic": "Validation & generalization"
  },
  {
    "id": "q10",
    "domain": "Data / ML / Evaluation",
    "question": "ماذا قد يحدث عند استخدام Regularization قوية جدًا؟",
    "options": [
      "Underfitting",
      "زيادة leakage",
      "تحويل classification إلى clustering"
    ],
    "answer": 0,
    "explanation": "الـregularization المفرطة تقيد النموذج أكثر من اللازم فتزيد bias.",
    "topic": "Validation & generalization"
  },
  {
    "id": "q11",
    "domain": "Data / ML / Evaluation",
    "question": "في classification شديد عدم التوازن مع Positive class نادرة، أي curve تكون غالبًا أكثر إفادة؟",
    "options": [
      "PR curve",
      "R² curve",
      "Residual plot"
    ],
    "answer": 0,
    "explanation": "Precision-Recall تركز مباشرة على أداء الفئة الإيجابية وتكون مفيدة في rare positives.",
    "topic": "Imbalance & model choice"
  },
  {
    "id": "q12",
    "domain": "Data / ML / Evaluation",
    "question": "لماذا قد يكون RMSE أكبر بكثير من MAE؟",
    "options": [
      "لأن RMSE يعاقب الأخطاء الكبيرة أكثر",
      "لأن MAE لا يقيس الخطأ",
      "لأن RMSE مخصص للتصنيف"
    ],
    "answer": 0,
    "explanation": "تربيع الأخطاء يجعل RMSE أكثر حساسية للأخطاء الكبيرة/outliers.",
    "topic": "Imbalance & model choice"
  },
  {
    "id": "q13",
    "domain": "Data / ML / Evaluation",
    "question": "أي metric للـregression أكثر مقاومة نسبيًا لتأثير outliers الكبيرة؟",
    "options": [
      "MAE",
      "RMSE",
      "Accuracy"
    ],
    "answer": 0,
    "explanation": "MAE لا يربّع الأخطاء، لذلك يتأثر بدرجة أقل بالقيم الشاذة الكبيرة.",
    "topic": "Imbalance & model choice"
  },
  {
    "id": "q14",
    "domain": "Data / ML / Evaluation",
    "question": "أي خوارزمية من الآتي تُستخدم عادةً للتصنيف الثنائي رغم اسمها؟",
    "options": [
      "Logistic Regression",
      "Linear Regression",
      "PCA"
    ],
    "answer": 0,
    "explanation": "Logistic Regression نمذجة احتمالية شائعة للتصنيف.",
    "topic": "Imbalance & model choice"
  },
  {
    "id": "q15",
    "domain": "Data / ML / Evaluation",
    "question": "أي خوارزمية شجرية لا تتطلب عادةً Standardization للميزات كي تعمل بشكل صحيح؟",
    "options": [
      "Decision Tree",
      "k-NN",
      "Gradient Descent linear model"
    ],
    "answer": 0,
    "explanation": "الأشجار تعتمد على حدود تقسيم ولا تعتمد على المسافات/المقاييس بالطريقة نفسها.",
    "topic": "Imbalance & model choice"
  },
  {
    "id": "q16",
    "domain": "Data / ML / Evaluation",
    "question": "ماذا يعني Standardization غالبًا؟",
    "options": [
      "تحويل feature لتصبح بمتوسط ≈0 وانحراف معياري ≈1",
      "حصر القيم دائمًا بين 0 و1",
      "حذف القيم المفقودة"
    ],
    "answer": 0,
    "explanation": "هذا هو Z-score standardization الشائع.",
    "topic": "Preprocessing & thresholds"
  },
  {
    "id": "q17",
    "domain": "Data / ML / Evaluation",
    "question": "ماذا يعني Min-Max Normalization غالبًا؟",
    "options": [
      "إعادة قياس القيم إلى نطاق مثل 0–1",
      "جعل الانحراف المعياري دائمًا 1",
      "تحويل النص إلى embeddings"
    ],
    "answer": 0,
    "explanation": "Min-Max يعيد قياس القيم إلى نطاق محدد.",
    "topic": "Preprocessing & thresholds"
  },
  {
    "id": "q18",
    "domain": "Data / ML / Evaluation",
    "question": "لديك feature اسمها Blood Type = A/B/AB/O بدون ترتيب طبيعي. أي encoding مناسب عادةً؟",
    "options": [
      "One-hot encoding",
      "ترتيب A=1,B=2,AB=3,O=4 كترتيب حقيقي",
      "PCA فقط"
    ],
    "answer": 0,
    "explanation": "One-hot يتجنب فرض ترتيب عددي غير موجود على الفئات الاسمية.",
    "topic": "Preprocessing & thresholds"
  },
  {
    "id": "q19",
    "domain": "Data / ML / Evaluation",
    "question": "ما الوظيفة الأساسية لـPCA؟",
    "options": [
      "تقليل الأبعاد مع الاحتفاظ بأكبر قدر ممكن من التباين",
      "زيادة عدد الفئات",
      "توليد labels جديدة"
    ],
    "answer": 0,
    "explanation": "PCA أسلوب تقليل أبعاد غير خاضع للإشراف.",
    "topic": "Preprocessing & thresholds"
  },
  {
    "id": "q20",
    "domain": "Data / ML / Evaluation",
    "question": "أي مهمة من الآتي Unsupervised Learning؟",
    "options": [
      "Clustering",
      "Binary classification",
      "Forecasting بقيم target معروفة"
    ],
    "answer": 0,
    "explanation": "Clustering يبحث عن بنية في البيانات دون labels.",
    "topic": "Preprocessing & thresholds"
  },
  {
    "id": "q21",
    "domain": "Data / ML / Evaluation",
    "question": "خفضت classification threshold من 0.5 إلى 0.3. ماذا يحدث غالبًا؟",
    "options": [
      "يزداد Recall وقد تنخفض Precision",
      "تنخفض Recall دائمًا وترتفع Precision",
      "لا يتغير شيء إطلاقًا"
    ],
    "answer": 0,
    "explanation": "خفض threshold يزيد عدد الحالات المصنفة Positive؛ غالبًا يرفع Recall على حساب مزيد من false positives.",
    "topic": "Preprocessing & thresholds"
  },
  {
    "id": "q22",
    "domain": "Core AI / Deep Learning / GenAI",
    "question": "لماذا نستخدم Activation Function غير خطية في neural network؟",
    "options": [
      "لتمكين النموذج من تمثيل علاقات غير خطية",
      "لإلغاء الحاجة للبيانات",
      "لضمان Accuracy=100%"
    ],
    "answer": 0,
    "explanation": "بدون nonlinearity تصبح طبقات خطية متعددة مكافئة تقريبًا لتحويل خطي واحد.",
    "topic": "Neural network basics"
  },
  {
    "id": "q23",
    "domain": "Core AI / Deep Learning / GenAI",
    "question": "ما وظيفة Backpropagation؟",
    "options": [
      "حساب gradients لنشر خطأ الـloss عبر الشبكة",
      "اختيار الـGPU",
      "تقسيم dataset"
    ],
    "answer": 0,
    "explanation": "Backpropagation يستخدم قاعدة السلسلة لحساب gradients للأوزان.",
    "topic": "Neural network basics"
  },
  {
    "id": "q24",
    "domain": "Core AI / Deep Learning / GenAI",
    "question": "Learning rate مرتفع جدًا. ما السلوك المحتمل؟",
    "options": [
      "تدريب غير مستقر أو تجاوز minimum",
      "تدريب أبطأ دائمًا لكن أكثر استقرارًا",
      "لا تأثير له"
    ],
    "answer": 0,
    "explanation": "خطوات كبيرة قد تجعل optimizer يتجاوز مناطق جيدة أو يتذبذب.",
    "topic": "Neural network basics"
  },
  {
    "id": "q25",
    "domain": "Core AI / Deep Learning / GenAI",
    "question": "ما معنى Epoch؟",
    "options": [